,SKU,Name,Price,InStock,Categories,Tags
669,1614,Goodra,192.00,185,"Dragon, Pokemon","Dragon, goodra, Hydration"
670,2856,Klefki,179.00,30,"Key Ring, Pokemon","Key Ring, klefki, Prankster"
671,3436,Trevenant,53.00,167,"Elder Tree, Pokemon","Elder Tree, Natural Cure, trevenant"
672,7042,Bergmite,119.00,248,"Ice Chunk, Pokemon","bergmite, Ice Chunk, Own Tempo"
673,5514,Avalugg,71.00,156,"Iceberg, Pokemon","avalugg, Iceberg, Own Tempo"
674,6099,Noibat,126.00,136,"Pokemon, Sound Wave","Frisk, noibat, Sound Wave"
675,1413,Noivern,75.00,159,"Pokemon, Sound Wave","Frisk, noivern, Sound Wave"
676,6107,Xerneas,30.00,171,"Life, Pokemon","Fairy Aura, Life, xerneas"
677,4540,Yveltal,59.00,215,"Destruction, Pokemon","Dark Aura, Destruction, yveltal"
678,5609,Zygarde,83.00,80,"Order, Pokemon","Aura Break, Order, zygarde"
679,1266,Diancie,27.00,231,"Jewel, Pokemon","Clear Body, diancie, Jewel"
680,3194,Hoopa,189.00,45,"Mischief, Pokemon","hoopa, Magician, Mischief"
681,4693,Volcanion,45.00,238,"Pokemon, Steam","Steam, volcanion, Water Absorb"
682,4851,Dartrix,169.00,169,"Blade Quill, Pokemon","Blade Quill, dartrix, Overgrow"
683,7059,Decidueye,106.00,268,"Arrow Quill, Pokemon","Arrow Quill, decidueye, Overgrow"
684,6456,Litten,132.00,150,"Fire Cat, Pokemon","Blaze, Fire Cat, litten"
685,9406,Torracat,184.00,186,"Fire Cat, Pokemon","Blaze, Fire Cat, torracat"
686,5027,Incineroar,36.00,201,"Heel, Pokemon","Blaze, Heel, incineroar"
687,7912,Popplio,158.00,83,"Pokemon, Sea Lion","popplio, Sea Lion, Torrent"
688,9296,Brionne,172.00,174,"Pokemon, Pop Star","brionne, Pop Star, Torrent"
689,2133,Primarina,143.00,36,"Pokemon, Soloist","primarina, Soloist, Torrent"
690,3914,Pikipek,51.00,246,"Pokemon, Woodpecker","Keen Eye, pikipek, Woodpecker"
691,2185,Trumbeak,59.00,30,"Bugle Beak, Pokemon","Bugle Beak, Keen Eye, trumbeak"
692,9306,Toucannon,77.00,176,"Cannon, Pokemon","Cannon, Keen Eye, toucannon"
693,1383,Yungoos,159.00,180,"Loitering, Pokemon","Loitering, Strong Jaw, yungoos"
694,3078,Gumshoos,123.00,125,"Pokemon, Stakeout","gumshoos, Stakeout, Strong Jaw"
695,3728,Grubbin,77.00,47,"Larva, Pokemon","grubbin, Larva, Swarm"
696,8497,Charjabug,76.00,21,"Battery, Pokemon","Battery, charjabug"
697,8322,Vikavolt,88.00,62,"Pokemon, Stag Beetle","Levitate, Stag Beetle, vikavolt"
698,5483,Crabrawler,181.00,212,"Boxing, Pokemon","Boxing, crabrawler, Hyper Cutter"
699,3027,Crabominable,65.00,188,"Pokemon, Woolly Crab","crabominable, Hyper Cutter, Woolly Crab"
700,3090,Cutiefly,118.00,23,"Bee Fly, Pokemon","Bee Fly, cutiefly, Shield Dust"
701,4694,Ribombee,100.00,233,"Bee Fly, Pokemon","Bee Fly, ribombee, Shield Dust"
702,9049,Rockruff,149.00,296,"Pokemon, Puppy","Keen Eye, Puppy, rockruff"
703,2097,Mareanie,47.00,99,"Brutal Star, Pokemon","Brutal Star, Limber, mareanie"
704,2160,Toxapex,91.00,37,"Brutal Star, Pokemon","Brutal Star, Limber, toxapex"
705,9977,Mudbray,96.00,117,"Donkey, Pokemon","Donkey, mudbray, Own Tempo"
706,6401,Mudsdale,111.00,136,"Draft Horse, Pokemon","Draft Horse, mudsdale, Own Tempo"
707,1034,Dewpider,84.00,23,"Pokemon, Water Bubble","dewpider, Water Bubble"
708,8489,Araquanid,48.00,281,"Pokemon, Water Bubble","araquanid, Water Bubble"
709,9109,Fomantis,104.00,209,"Pokemon, Sickle Grass","fomantis, Leaf Guard, Sickle Grass"
710,1903,Lurantis,159.00,269,"Bloom Sickle, Pokemon","Bloom Sickle, Leaf Guard, lurantis"
711,8895,Morelull,87.00,71,"Illuminating, Pokemon","Effect Spore, Illuminating, morelull"
712,1758,Shiinotic,75.00,123,"Illuminating, Pokemon","Effect Spore, Illuminating, shiinotic"
713,7448,Salandit,158.00,54,"Pokemon, Toxic Lizard","Corrosion, salandit, Toxic Lizard"
714,4114,Salazzle,166.00,142,"Pokemon, Toxic Lizard","Corrosion, salazzle, Toxic Lizard"
715,6729,Stufful,70.00,69,"Flailing, Pokemon","Flailing, Klutz, stufful"
716,7159,Bewear,117.00,96,"Pokemon, Strong Arm","bewear, Klutz, Strong Arm"
717,6963,Bounsweet,193.00,76,"Fruit, Pokemon","bounsweet, fruit, Oblivious"
718,9509,Steenee,27.00,30,"Fruit, Pokemon","fruit, Oblivious, steenee"
719,1097,Tsareena,186.00,96,"Fruit, Pokemon","fruit, Leaf Guard, tsareena"
720,1719,Comfey,28.00,266,"Pokemon, Posy Picker","comfey, Flower Veil, Posy Picker"
721,6539,Oranguru,139.00,241,"Pokemon, Sage","Inner Focus, oranguru, Sage"
722,8046,Passimian,182.00,144,"Pokemon, Teamwork","passimian, Receiver, Teamwork"
723,2207,Wimpod,137.00,87,"Pokemon, Turn Tail","Turn Tail, Wimp Out, wimpod"
724,6420,Golisopod,32.00,10,"Hard Scale, Pokemon","Emergency Exit, golisopod, Hard Scale"
725,7020,Sandygast,131.00,276,"Pokemon, Sand Heap","Sand Heap, sandygast, Water Compaction"
726,8991,Palossand,187.00,19,"Pokemon, Sand Castle","palossand, Sand Castle, Water Compaction"
727,3988,Pyukumuku,97.00,191,"Pokemon, Sea Cucumber","Innards Out, pyukumuku, Sea Cucumber"
728,5805,Silvally,133.00,64,"Pokemon, Synthetic","RKS System, silvally, Synthetic"
729,4350,Komala,65.00,231,"Drowsing, Pokemon","Comatose, Drowsing, komala"
730,4932,Turtonator,117.00,16,"Blast Turtle, Pokemon","Blast Turtle, Shell Armor, turtonator"
731,9583,Togedemaru,45.00,78,"Pokemon, Roly-Poly","Lightning Rod, Roly-Poly, togedemaru"
732,7808,Drampa,133.00,245,"Placid, Pokemon","drampa, placid, Sap Sipper"
733,9665,Jangmo-o,107.00,140,"Pokemon, Scaly","jangmo-o, Scaly, Soundproof"
734,9648,Hakamo-o,57.00,288,"Pokemon, Scaly","hakamo-o, Scaly, Soundproof"
735,3513,Kommo-o,170.00,121,"Pokemon, Scaly","kommo-o, Scaly, Soundproof"
736,9744,Tapu-koko,159.00,215,"Land Spirit, Pokemon","Electric Surge, Land Spirit, tapu-koko"
737,3073,Tapu-lele,62.00,71,"Land Spirit, Pokemon","Land Spirit, Psychic Surge, tapu-lele"
738,2204,Tapu-bulu,165.00,175,"Land Spirit, Pokemon","Grassy Surge, Land Spirit, tapu-bulu"
739,5525,Tapu-fini,123.00,206,"Land Spirit, Pokemon","Land Spirit, Misty Surge, tapu-fini"
740,4928,Solgaleo,125.00,260,"Pokemon, Sunne","Full Metal Body, solgaleo, Sunne"
741,3888,Lunala,58.00,195,"Moone, Pokemon","lunala, Moone, Shadow Shield"
742,6763,Nihilego,67.00,180,"Parasite, Pokemon","Beast Boost, nihilego, Parasite"
743,5256,Buzzwole,172.00,43,"Pokemon, Swollen","Beast Boost, buzzwole, Swollen"
744,4102,Pheromosa,62.00,254,"Lissome, Pokemon","Beast Boost, Lissome, pheromosa"
745,3791,Xurkitree,174.00,120,"Glowing, Pokemon","Beast Boost, Glowing, xurkitree"
746,9458,Celesteela,151.00,58,"Launch, Pokemon","Beast Boost, celesteela, Launch"
747,8035,Kartana,197.00,77,"Drawn Sword, Pokemon","Beast Boost, Drawn Sword, kartana"
748,3767,Guzzlord,73.00,54,"Junkivore, Pokemon","Beast Boost, guzzlord, Junkivore"
749,6307,Necrozma,68.00,141,"Pokemon, Prism","necrozma, Prism, Prism Armor"
750,1160,Marshadow,107.00,250,"Gloomdweller, Pokemon","Gloomdweller, marshadow, Technician"
751,1771,Poipole,130.00,21,"Poison Pin, Pokemon","Beast Boost, poipole, Poison Pin"
752,9798,Naganadel,30.00,255,"Poison Pin, Pokemon","Beast Boost, naganadel, Poison Pin"
753,1947,Stakataka,190.00,210,"Pokemon, Rampart","Beast Boost, Rampart, stakataka"
754,8843,Blacephalon,149.00,205,"Fireworks, Pokemon","Beast Boost, blacephalon, Fireworks"
